,Unnamed: 0,Time,Title,Category,Salary,Company,Company Reviews,Company Rating(out of 5),Url,Location,Description,min_experience,max_experience,short_type
905,905,30+ days ago,Colocation Data Center Field Engineer,Data Engineer,,Amazon Data Services HongKong,,3.6,https://www.indeed.hk//rc/clk?jk=e8b728db37903727&fccid=fe2d21eef233e94a&vjs=3,"Causeway Bay, Hong Kong Island","Causeway Bay, Hong Kong IslandBachelor’s Degree in Mechanical or Electrical Engineering5+ years of experience with leading MEP designs and/or complex root cause analyses in industrial or commercial in Mission Critical facilities combined with 1+ years of performing due diligence, design gap analysis, and/or operational performance audits of Mission Critical facilitiesStrong command and fluency in English both spoken and written.Fluent in ChineseComfortable with regular regional and global travel up to 50% of the time.

Amazon’s Data Centers are industry leading examples of innovation in the areas of data center critical infrastructure design, space utilization, energy efficiency, and cost effectiveness. We are known for our speed to market, reliability, and lowest total cost of ownership. Our Engineers are on the forefront of creating and delivering the most innovative products to our customers; and are known for being a diverse and upbeat team that is continually improving the world of cloud computing. We continue to grow and are looking for individuals that can support our mission, enjoy a challenge, and have a desire for professional growth and continuous learning. Amazon’s work environment is unique in every aspect and offers an exceptional opportunity for the right candidate. If you are a creative, smart, and driven individual that enjoys working with complex problems, we want YOU!

Amazon Web Services (AWS) is seeking a Colocation Field Engineer with a Mechanical and/or Electrical Engineering background in mission critical facilities design, field, or operational engineering experience to become part of a global team that is responsible for performing availability and performance audits of our Colocation data centers. As engineers at Amazon, we are responsible for achieving a world class uptime for our customers so we need to ensure that our Colocation data centers have resilient designs, cost effective systems, and an industry leading operational management program. As one of our Colocation Field Engineers, you will work directly with the engineering and/or operations teams for the Colocation data centers within your assigned region to drive continuous advancements and improvements within their designs and operations. We will look to you for identifying availability risks then to provide suggestions for improving the availability/costs/performance/simplicity of the equipment/system designs and operational readiness programs. This will include reviewing existing designs and contributing your field experience to collaborate with the other peer engineering teams to develop approved remediation plans for any issues found in the field. Amazon has a global presence, therefore, domestic and international travel will be necessary. Team work is absolutely necessary for us to accomplish our goals. You must be able to work within a team and depend on others to accomplish the required tasks. This includes working with internal groups as well as external suppliers and consultants, including utilities, manufacturers, vendors, and contractors.

If you have an understanding of the critical equipment needs for large infrastructure mission critical sites and equipment; especially data centers, and understand the constructability and maintainability of varying designs, you may be a good fit.

Responsibilities
The Colocation Field Engineer will be responsible for the following:
Understanding the design and functionality of the data centers within your assigned region(s)Traveling to different data center regions to conduct engineering evaluations of critical infrastructure designs, equipment performance, equipment settings, and commissioning resultsInterpreting/evaluating Single Line Drawings (SLD), as-built drawings, equipment submittals, equipment specifications documentation, and performance dataCreating detailed audit reports along with identifying solutions to remediate any immediate threats to our operationsLeading internal teams to conduct Root Cause Analysis (RCA), developing Corrective Action (CA) solutions/plans for design gaps and performance related problems, and reporting status of implementationsCollaborating with Design and Commissioning Engineers to properly test and validate installation, operation, and performance of electrical/mechanical systems per the design intent; then using this data to calibrate our performance modelsReporting results of audits to Operations and Engineering teamsWorking on concurrent projects in multiple geographical regionsBeing a leader within the group as well as within other teamsBeing positive and always offer creative, out of the box solutionsHaving fun and working hard!

Master’s Degree in Mechanical or Electrical EngineeringLicensed Professional Engineer (for US-Based positions)5+ years of continuous operating redundant electrical systems, cooling systems, water and air distribution systems, air flow containment systems, and building management systems. This includes but is not limited to: uninterruptable power sources, diesel generators, MV and LV electrical switchgear, power distribution units, variable frequency drives, automatic/static transfer switches, chillers [air-cooled and water-cooled], pumps, cooling towers, heat exchangers, air handlers, air economizers, etc.10+ years of direct experience with the design, construction, operation, or maintenance of mission critical data centersLicensed Professional Engineer (for US-Based positions)Experience with developing solutions and executing plans on fast track design/build projects and/or multiple significant upgrade projectsExperience with commissioning and/or performance testing of critical infrastructure and the associated controls systems for mission critical environmentsSystem Matter Expert level of understanding of both mechanical and electrical equipment/design related to data centersGood working knowledge of electrical system protection and co-ordination schemesKnowledge of building codes and regulations including Life Safety, IBC, NFPA, NEC, ASHRAE, and OSHAPossess excellent attention to detail and communication skills in order to maintain high quality standards for being organized, setting priorities, meeting deadlines, and staying within budgetsPossess leadership and problem solving skillsLEAN Engineering experience or certificationsISO9001 or similar certificationsUptime Institute Tier or Operational Sustainability Accredited Specialists CertificationMeets/exceeds Amazon’s leadership principles requirements for this roleMeets/exceeds Amazon’s functional/technical depth and complexity for this role",,,DE
906,906,18 days ago,"Senior Engineer (Data Center Facility Management), HK$400 to 600K",Data Engineer,,Premium Partner Limited,,,https://www.indeed.hk//rc/clk?jk=c0657052262bb8a4&fccid=14cde6e5bf425256&vjs=3,Hong Kong,"Hong KongPremium Partner provides permanent, contract and secondment placement service. We partner with fortune 500 companies, listed Co. and high quality boutique firms.
Premium Partner aims to maintain long term partnership with job seekers, our consultants will provide career planning advice, share industry market information and match the dream job with job seekers.
To know more please click: www.pp

Our client, a global telecommunication service provider, is now seeking a building services engineering professionals to their regional maintenance and service team.

Senior Engineer (Data Center Facility Management)

Responsibilities:

Perform maintenance and facilities management duties of Data Center
Ensure the high availability of building system of data centre, included but not limited to fire system, UPS, cooling system, etc..
Provide technical support for urgent matter
Work with vendor for maintenance and repairing issue
Involve in regional new build and enhancement data center projects

Requirements:

Higher Diploma or above in Building Service / Mechanical Engineer
Minimum 5 years experience in building service engineering
Familiar in critical facilities management will be an advantage
Hands-on working experience in data center
With experience in data centre related standards, such as ISO auditing will be an advantage
Candidates with less experience will be considered as Engineer

Interested candidates, please click ""APPLY NOW""


All personal information collected will be for recruitment purpose only

",5.0,5.0,DE
907,907,30+ days ago,Data Center Engineer (Cabling),Data Engineer,,Talent Blue,2.0,5.0,https://www.indeed.hk//rc/clk?jk=1e6c5edf2fc8dacd&fccid=d78410deff673ba7&vjs=3,Hong Kong,"Hong KongOur client, a major Data Center in Hong Kong is seeking a Data Center Engineer (Cabling).
Responsibilities:

As the Cabling Expert of the IDC, to provide cabling design and solution.
Partner with technical, network operation facility management to provide the best cabling system to the company.
To supervise external vendors on services quality
To identify business requirements and carry out implementation.
Knowledge in TIA-942 infrastructure standard
 Requirements:

Degree in Information Technology Management
At least 4 years working experience in data centre.
BISCI-RCDD is an advantage
30K per month + bonus
Interested parties please send your resume to:

stephen.chow@talentbluesearch.com

Details
Reference #: TB-282
Industry: Information Technology and Telecommunications
Job Function: Engineering
Level: Officer
Annual Package: 1 Million below",4.0,4.0,DE
908,908,30+ days ago,Data Engineer,Data Engineer,,PEOBASE Limited,,,https://www.indeed.hk//rc/clk?jk=e927b85d96682291&fccid=4e3be47709d0a343&vjs=3,Hong Kong,"Hong KongOne of the Global MNC which is the market leader of its field and has offices in 70 countries, is now seeking a data engineer to join their professional team in Hong Kong.

Responsibilities

Design, develop and maintain the Data Management Solution (incl. Data Warehouse)
Support the analysis work by building the conceptual model, data model and executing information gathering, and data aggregation
Design and develop architecture and application to present the analysis result
Technical solution evaluation and recommendation, including software tool and technology;
Cooperate with different parties to complete the project
Requirements

Degree Holder or above in Computer Science or related disciplines
Min. 3 years’ working experience
Solid experience on Enterprise application development
Supervisory experience is preferred
Familiar with Hadoop, Spark, Spotfire, Python, R, SQL
Passionate in data management, data analysis and business intelligence
Good interpersonal, presentation and communication skills
Good analytical and problem solving skills
Good command of spoken and written English and Chinese
How to Apply

Interested parties please send your full resume in WORD format with your current and expected salary including HKM1611041916 in the subject to jobs@PEOBASE.com.

All information received will be kept in strict confidence. Only short-listed candidates will be notified.",3.0,3.0,DE
909,909,30+ days ago,Data Engineer / Analyst,Data Engineer,,Match Talent,,,https://www.indeed.hk//rc/clk?jk=3210cfac99072a79&fccid=4da850c42dac5cb0&vjs=3,Hong Kong,"Hong KongPermanentResponsibilities:
Collaborate with business users across the organization to assess their needs and define analytical strategy
Assist the evaluation, selection and implementation of tools for data integration
Involve with campaign production specialist to design and implementing targeting campaign
Analyse structured and unstructured data, visualize findings and discover insights via data modelling, and optimization technique
Collaborate with a broad spectrum of stakeholders, including marketers, technical expertise and product teams, etc.
Requirements:
Degree Holder in Computer Science
Minimum 2 years solid experience in data field
Experience in Python, Scala, SAS, Perl, MATLAB or other tools appropriate for large scale data analysis would be a plus
Experience in Hadoop framework, SQL is desirable
Solid experience in conducting business and system analysis with strong business acumen, and able to communicate actionable insights to management and non-technical audience
Good analytical and communication skills and ability to work in a collaborative environment",2.0,2.0,DE
910,910,18 days ago,Data center Operator / Facility Engineer,Data Engineer,,Eternity Consulting,,,https://www.indeed.hk//rc/clk?jk=ad6fc9187142cca3&fccid=2287a56a23fc60c0&vjs=3,Hong Kong,"Hong KongPermanentBenefits: double pay, bonus, 14AL, medical, etc Employment: permanent job and our client will directly employ candidate As a subsidiary of a corporation listed in Singapore, our client is a Datacenter solutions with ~1,500 staff in 30 offices worldwide . It is looking for a post below: Job Description Receiving equipment at loading dock Checking of Delivery Order (DO) with physical devices Escorting visitor Changing of Visitor pass and scanning of visitor before access into DC Staging the equipment in the Burn room. Racking device Installing of railing bracket onto rack Inserting of railing kit onto server Inserting of blanking panel onto rack Writing down the server Serial number Paste Hostname and barcode labels for inventory record. Power Cord Cabling Assembly of the power cord for the server & switch Installation of Grounding cable for Switches Dressing up of power cord cables. Documentation & Administration Using End-user software to update records of work done
 Higher Diploma / Diploma",,,DE
911,911,30+ days ago,Data Centre Assistants / Engineers,Data Engineer,,TOP PERSONNEL CONSULTANT,,,https://www.indeed.hk//rc/clk?jk=932d3b8c0b896f7f&fccid=008b61ae4c337566&vjs=3,"Tsuen Wan, New Territories","Tsuen Wan, New Territories工作內容 : Perform data Centre operations, equipment maintenance and system administration


要求學歷 : Post-secondary (Diploma/Certificate); Fluent Cantonese ; Fluent Putonghua ; Fluent English ; Able to read & write Chinese ; Able to read & write English ; TI/U Grad. in Computer Science. Fresh/exp. in system admin exp. Familiarity with Windows Server



上班時間 : $14,000 - $20,000 per month, with Annual Leave 12 days, Bonus and Medical Benefits, Mon to Fri: 9:00AM-6:00PM, 5 working days per week, 8 working hours per day


上班地址 : Tsuen Wan


薪金 : 每月$14,000 - $20,000",0.0,,DE
912,912,11 days ago,Data Engineer- IT (NG Project Management) (For a 12 month Contract),Data Engineer,,Hong Kong Exchange,,,https://www.indeed.hk//rc/clk?jk=95169bac4c1dd06a&fccid=8a01ef68fc07d03e&vjs=3,Hong Kong,"Hong KongData Engineer- IT (NG Project Management) (For a 12 month Contract) (Requisition ID: IRC4517)
We are on an exciting journey of simplifying and transforming HKEX’s data landscape. We aim to empower the staff and clients of HKEX with the use of data, and to improve efficiency and profitability of HKEX’s business by making data-driven decisions. An exciting time lies ahead and we are now inviting experienced Data Engineers to join our team.

The position we offer: As a Data Engineer, you will develop, maintain, test and evaluate Big Data solutions within our cloud-based Big Data Platform. You will also be involved in the design of Big Data solutions to priority business challenges. You should have extensive experience in software development with agile methodology, continuous integration and automated releases. Experience in engineering (commercial or open source) software platforms and large-scale data infrastructures (preferably on cloud) is a must.

Job Responsibilities:
Building distributed and highly parallelised Big Data ingestion and processing pipeline which is able to process massive amounts of data (both structured and unstructured data) in near real-time
Evaluate and deploy data quality framework to measure and improve data quality in the organisation over time
Engage with data stewards, producers and consumers to design appropriate data pipelines
Automate processes where possible and are repeatable and reliable
Work closely with Site Reliability Engineers and Product Managers to deliver software in a continuous delivery environment

Job Requirements:

We expect the ideal candidate to have extensive experience (4+ years) in data engineering and be a complex problem solver.
You should be able to write production code in Scala or Python and have strong interests in the latest Data Technology:
Data driven thinking
Experience in container technologies (OpenShift, Docker or k8s)
Delivery focus with strong product mind-set
Knowledge in design and implementation of data infrastructure on AWS or GCP
Excellent communication skills and experience working in cross functional teams
Preferably you also have:
Experience in Apache Spark and Nifi
Experience in in-memory data processing
Experience in implementing data security capabilities such as encryption and anonymisation
Solid grounding in the Financial Services industry
Solid knowledge in SQL
Understanding in statistical models, machine learning, graph analysis You will be joining a cross functional team in a highly international environment based in Hong Kong, London and ShenZhen.
Applicants who do not hear from us within 6 weeks may consider their applications unsuccessful. Personal data provided will only be used for the purpose of employment application to HKEX.
Primary Location: Asia Pacific-Hong Kong
Job: Information Technology/ FinTech
Job Posting: 15-Jul-2019, 8:22:04 AM
Unposting Date: Ongoing",,,DE
913,913,30+ days ago,Data Engineer,Data Engineer,,Argyll Scott,,,https://www.indeed.hk//rc/clk?jk=ad8fd2f33334aeb0&fccid=42461e5d7843c8f4&vjs=3,Hong Kong,"Hong KongPermanentA well established FinTech firm is currently looking for a Data Engineer to join their team in Hong Kong and help build and enhance new and existing data management platforms from collection to visualisation. They have been granted a virtual banking licence so if you want to be at the forefront of a banking revolution then read on.

The platform uses data analysis, machine learning and AI so any experience with these will be very helpful.

Responsibilities

Develop and implement the end to end data pipeline from collection, analysis to visualisation
Apply data analysis, machine learning, and incorporating AI into the platforms
Manage the data warehouse and apply the best technology to optimize the scalability and performance of the business
Collaborate with all internal teams to strengthen data governance and ensure consistent application
Provide support for data issues, maintain best practices for data management and provide support where necessary for the data projects
Requirements

Bachelor degree in IT, Computer Science or related discipline
5+ years relevant experience in data modelling and data management
Knowledge in one or more data technologies e.g Spark, Flink, Kafka, Hadoop, Tensorflow etc.
Operate the end to end data pipeline from data collection to data cleansing
Work with non-tech teams and provide support for business ops
Able to draw insights about customers, business, markets, and growth opportunities using data analysis
Strong passion in emerging technology
Spoken and Written English and Cantonese/Mandarin are essential

Your next steps are to apply with an updated CV to dgrayargyllscott.com.hk for a confidential discussion

Argyll Scott Asia is acting as an Employment Agency in relation to this vacancy.",,,DE
914,914,30+ days ago,Project / Facility Engineer - Data Center,Data Engineer,,Gemini Personnel,,,https://www.indeed.hk//rc/clk?jk=6e657b2a0646f7cc&fccid=13f5f0f6c348b302&vjs=3,Hong Kong,"Hong KongFacility Engineer
Duty:
 Responsible for the planning and design on Data Centre projects including the quality review & audit, capacity management, vendor management and project implementation.
 Coordinate with different parties covering the fitting out works, building services, HVAC systems, electrical services, generators, UPS, fire services, security systems, BMS, etc.
Requirement:
 Degree holder in Electrical / Mechanical / Building Services Engineering or equivalent.
 Min 5 years practical experience and knowledge in building service facilities planning, design and build of the Telecom Data Centre
 Experience and knowledge in large-scale electrical systems, UPS, generators, HVAC system, fire services, security systems, BMS, etc preferred
 Project control and project management experience in Data Centre construction",5.0,5.0,DE
915,915,30 days ago,Data Engineer (ETL/ Big Data),Data Engineer,,Michael Page,244.0,3.4,https://www.indeed.hk//rc/clk?jk=f365a57ee9f5c330&fccid=77087bd1709a8148&vjs=3,Hong Kong,"Hong KongPermanentFunction:IT
Specialisation:Business Intelligence
Industry:Energy & Natural Resources
Location:Hong Kong
Contract Type:Permanent
Consultant name:Eliza Lai
Consultant phone:+852 2848 9544
Job Reference:4081315",,,DE
916,916,30+ days ago,Data Analyst / Engineer,Data Engineer,,Swing Consulting,,,https://www.indeed.hk//rc/clk?jk=bdac209183b27a27&fccid=b6285137c7f32920&vjs=3,Hong Kong,"Hong KongDevelop and implement end to end data pipeline from collection, analysis to visualisation
Manage data warehouse and apply data analysis for data modelling, solution design and development
Provide support for data issues, maintain best practices for data management and provide support where necessary for the data projects
Collaborate with business product, design, operations, marketing and growth team to strengthen data governance and ensure consistent application
Responsible for data governance and ETL
Work on ad-hoc projects when required
Degree or above in Statistics, Data Science, Computer Science, IT and Mathematics or related disciplines
Good understanding of data modelling and data management process
Good command in Python, R and SQL
Strong in ETL, data technologies and tools, such as Qlik View, Sense or Tableau, Hadoop, Spark, Kafka, Informatica Centre, SSIS
Detail oriented with strong analytic skill
Good command in both written and spoken Chinese and English

Registering your information in our database let use easier to match the most suitable job for you. Please fill in the following form to get registerd in our database or you may email your information in MS WORD format directly to jobs@swing-hk.com.",,,DE
917,917,16 days ago,Data Warehouse/ Data/ ETL Engineer/ Analyst - CRM,Data Engineer,,ConnectedGroup Ltd,,,https://www.indeed.hk//rc/clk?jk=ff83591d49894584&fccid=bd5a3434f7ec2788&vjs=3,Hong Kong,"Hong KongPermanentWell established and growing company in Hong Kong
Focus on data cleansing & warehouse maintenance
In death experience in SQL programming required
Job functions:

Work closely with CRM team to maintain and develop a centralised data warehouse for customers database management
Responsible for ETL programming development, data warehouse maintenance, data integration projects and etc
Oversee and manage the work-flow of data quality management, data cleansing and data exchanges processes by designing and implementing different rules and best practice
Work closely and support the data analysis work of Data Analytic and CRM team
Job requirements:

Bachelor's degree holder in Statistics, Mathematics & Computer Science
Over 3 years' experience in SQL and ETL Programming
Solid knowledge on data cleaning and warehousing
Solid exposure on data integration tools and development of API
Good command in both Cantonese and English
Interested individuals can press apply now and please send your CV in WORD format. Feel free to contact Shirley Lam at +852 3972 6563 for more information.

For a more comprehensive list of our vacancies, please visit: www.connectedgroup.com
ACOG-308723_156266558306508",3.0,3.0,DE
