,Unnamed: 0,Time,Title,Category,Salary,Company,Company Reviews,Company Rating(out of 5),Url,Location,Description,min_experience,max_experience,short_type
918,918,1 day ago,"Senior / Network Engineers (Data Network / Network Security) - CCNA, Cisco, firewall",Data Engineer,,Hire and Seek Limited,,,https://www.indeed.hk//rc/clk?jk=f35308095532295c&fccid=96b16ab7658b69ab&vjs=3,Hong Kong,"Hong KongOur mission is to accelerate the operational efficiency of clients through our systematic approach in talents management and trendy human capitals management tool in organization and people development in the region. With our extensive network of contacts and efficient search method, we are able to meet clients' needs and expectations by providing speedy, competitive and cost-effective recruitment solutions
We are a professional provider of human resource services, focusing on Hire excellent candidates and Seek excellent job opportunities.
Our services specialize in a range of industry and professional sectors, namely IT & Telecom, Building & Construction, Accounting & Finance, Banking & Financial Services and Engineering.
We are an equal opportunity employer. Personal data collected will be used for recruitment related purposes only. www.hire-and-seek.com Tel: 2868 3348

POST 1:
Permanent positions with one of the leading company in Hong Kong.
Benefits : 5-day work, Double pay, Life insurance, Medical insurance
Working Location: Kowloon

Responsibilities:
Perform operations and maintenance support for data networking
Monitor & maintain network/system performance in good condition
Assist in trouble shooting and handle service enquiry
Assist in system documentation and preparation of reports

Requirements:
Knowledge in Layer 2/3 switching, IP product, Routing Protocols, MPLS, Firewall, BGP, DNS, Cache Server
Holder of CCNA / CCNP / JNCIS / JNCIP is an advantage but not a must
Experience in Mobile network, Unix/windows base is preferred

POST 2 :
Permanent positions in both data networking or network security areas with one of the leading solution provider/vendor in Hong Kong.
Benefits : Performance bonus, Medical insurance, 5-day work
Working Location: Kowloon/HK Island/New Territories

Responsibilities:
Plan and manage implementation of network and different technologies projects
Administrate, maintain and on-site support of network performance/network security environment
Project implement and installation of computer systems
Assist in system documentation and preparation of reports
Requirements: Degree / higher diploma holder in computer Engineering or equivalent Knowledge in Routers / Switches / load balancers / Firewall / Traffic Controller Skills in CheckPoint / Cisco / Juniper firewalls or holder of CCNA / CCNP / JNCIS / JNCIP is an advantage",,,DE
919,919,30+ days ago,Senior Network Engineer – Data Center Operation,Data Engineer,,Talent Blue,2.0,5.0,https://www.indeed.hk//rc/clk?jk=a136d2a136959ffa&fccid=d78410deff673ba7&vjs=3,Hong Kong,"Hong KongOur client, a Major Data Center in Hong Kong is seeking a Senior Network Engineer to lead the Network design and implementation for the Optical and IP network infrastructure.

This is a great opportunity for Network Engineer Professional to join the a top data center and exposure to work with top clients such as telecommunication carrier and enterprise clients.
Responsibilities:

To drive design and carry out of network infrastructure
As project manager, you will lead the site preparation, equipment staging, installation and commissioning, network acceptance test and project document upon completion of the project
Management of progress of the projects milestone
Identify, resolve and escalate issues to Network team and clients
Provide consultancy and advice to Network team and clients
Performs research, write, publish, and control configuration of manuals/documentation for technical design specification, equipment, system operation, and maintenance
Explore new technology, such as SDN, NFV
Requirements:

Degree holder in Information Technology Management, computer science, engineer or other related discipline.
At least 8 years of experience of network designing experience from enterprise, data center or telecommunication carriers, internet service, etc.
Solid experience in optical network, IP network and IT security design and administration
Experience to work with clients.
Holder of professional certification is preferred i.e. CCIE, CCNP, CCNA
Candidate with less experience may be considered Network Engineer
500K – 600K per annual

Interested parties please send your resume to stephen.chow@talentbluesearch.com
Details
Reference #: TB-287
Industry: Information Technology and Telecommunications
Job Function: Information Technology
Level: Manager
Annual Package: 1 Million below",8.0,8.0,DE
920,920,30+ days ago,Senior Data Engineer,Data Engineer,,Hays,719.0,3.6,https://www.indeed.hk//rc/clk?jk=e029bfe0e5f31523&fccid=31670bef3ae6497b&vjs=3,Hong Kong,"Hong KongThis is a financial technology company with one of the leading mobile lending platform in Asia. International and fun team who work under a fast paced environment.


Your new role

In this role you will be responsible for:
Develop data pipeline from collection, analysis to visualization.
Utilize the latest technology tools on daily basis and data warehouse management, to maximize the business growth.
Knowing how to do data analysis and machine learning, and support for data issues.
Work with Marketing, Product, Design and Growth and other related team to enhance the data governance and maintain application amount.
Willing to help in ad hoc project when needed.


What you'll need to succeed


As the successful candidate you will have:
Bachelor degree in Computer Science, Finance, Statistics or any other quantitative related discipline.
With 3-5 years of experiences in data modelling and data management.
Collaborate with non-technical team and backing up for business operations
Provide Customers and business insights through doing data analysis.
With knowledge on one more data technologies (i.e. Speak, Flink and Tensorflow).
Capable to operate the pipeline, from data collection to data cleansing.
Good communication and presentation skills


What you'll get in return

You are joining a financial technology company who is expanding their data teams. They are moving to a cloud environment and are looking for people who like to work on a variety of fast paced projects. You will work in an agile environment and will work with some of the best in the industry.


What you need to do now

If you’re interested in this role, click “apply now” or for more information and a confidential discussion this role or to find out more about IT and Digital opportunities contact Carina Choi at +852-2230-7437 or Carina.Choi@hays.com.hk Follow Hays for the most up-to-date career advice and insights on the world of work: #1153923",5.0,5.0,DE
921,921,30+ days ago,Senior Engineer - Data Center Facility,Data Engineer,,PEOBASE Limited,,,https://www.indeed.hk//rc/clk?jk=9a904de455b768c5&fccid=4e3be47709d0a343&vjs=3,Hong Kong,"Hong KongA Regional Data Center Service Provider is now seeking a Senior Engineer (Facility) to join their team in Hong Kong.

Responsibilities

Oversee Date Center facilities including operation and maintenance.
Execute power distribution, mechanical, electrical, and HVAC operations.
Inspect all installed equipment occasionally and maintain accurate maintenance records.
Ensure the uptime of those mission-critical facilities by performing preventive and corrective maintenance
Assure the site complies to the company health and safety policy
Document and report all facility related problems.
Manage third-party vendors and contractors.
Requirements

Degree Holder in building services or equivalent.
At least 5 years relevant experience
Experience in Data Center operations is a must
Know-how of commercial installations, field faultfinding, maintenance and repairs are essential.
Knowledge in Diesel Generators, UPS Systems, DC Power distribution, Pre-action Fire systems is prefered.
Able to interpret building services drawings and services schematics.
Hands on experience on computer controlled HVAC, mission critical power systems, building automation and controls.
Effective written and verbal communications skills
Ability to use Windows, Outlook, Excel, Visio and Word.
Ability to learn quickly, and provide on-call support in case of emergencies or other off-hours issues at the facility.
Ability to work independently and within a team environment.
Well-developed customer service skills.
Higher Diploma or Associate Degree holder will also be considered.
How to Apply

Interested parties please send your full resume in WORD format with your current and expected salary including the Ref: HKM1405201904 in the subject to jobs@PEOBASE.com.

All information received will be kept in strict confidence. Only short-listed candidates will be notified.",5.0,5.0,DE
922,922,30+ days ago,Data Engineer - Fortune 500 US Insurance,Data Engineer,,Hays,719.0,3.6,https://www.indeed.hk//rc/clk?jk=a1a39144fa0f3d8e&fccid=31670bef3ae6497b&vjs=3,Hong Kong,"Hong KongYour new company is a Fortune 500 Insurance. They have excellent exposure within the Asia Pacific Region. The organisation is currently experiencing tremendous growth and is seeking an experienced Data Engineer.


Your new role

In your new role you will be responsible for:

Manage the cloud-based data infrastructure and meeting the security requirements
Design and build the ETL jobs to process data sources
Work on projects involved with the data pipelines, data modelling and data mart solutions
Collaborate with data scientists to create end to end data driven solutions

What you'll need to succeed

To succeed you will need to have:

Degree holder in IT/Computer Science/Engineer or related discipline. Advanced degree is an advantage
At least 3 years of experience with data analytics, data modelling, and database design
Experience with SQL and one scripting language (Python/Java/Scala)
Strong understanding of using cloud services (AWS/Azure/Google Cloud Platform)
Experience with ETL tools

What you'll get in return

For your hard work, commitment and expertise you will be rewarded with an excellent opportunity with an ambitious and innovative fortune 500 insurance The insurance, one of the fastest growing multinational insurance worldwide will truly value career development.


What you need to do now

If you’re interested in this role, click “apply now” or for more information and a confidential discussion this role or to find out more about IT and Digital opportunities contact Wesley Au-Yeung at +852 2230 7436 or Wesley.auyeung@hays.com.hk #1148769",3.0,3.0,DE
923,923,30+ days ago,"Field Engineer - IT Infrastructure Operations, Data Centre Operations",Data Engineer,,George Samuel Associates Ltd.,,,https://www.indeed.hk//rc/clk?jk=1ccf10c10f6b7c97&fccid=5c9f0be94ebaea21&vjs=3,Hong Kong,"Hong KongContractResponsibilities :


To carry out daily technical support on bank's open platforms, mainframes, database systems, and data centre facilities.

TO ensure production problems under Technology Infrastructure Services are being resolved and properly followed up by service providers to minimise business impacts.

Monitor, control and maintain tracking of IT equipment move-in/out at Data Centre and server rooms

Perform checking and reconciliation of banking IT devices and assets onsite.

Manage vendors to deliver quality IT services for Data Centre and server rooms in accordance with agreed SLA

Coordinate among vendor supports to follow up alerts detected and incidents for facilities at data centre and server rooms

Ensure daily operations at Data centre and server rooms are comply with bank's processes

Responsible for the Technology Infrastructure Open platforms Windows, AIX, LINUX, VMWare platforms and database systems daily BAU support

Manage and work with vendors onsite to deliver IT services

Provide 7x24 technical support to the bank's IT Infrastructure operations and projects.


Requirements :


At least 5 years Strong experience in Windows and AIX technical support, With WIndows 2012 MCSE Server Infrastructure

Good knowledge of VMWare, SQL, DB2, and Oracle database

Experience with IBM Open Systems products such as TWS, ITM, TMS and On-Demand

Technical knowledge with structured cabling and Data Centre Facility Management

Fluent in both written and spoken English and Chinese

Please email to : itjob@gsamuel.com.hk to submit your resume in MS Word format, specifying your availability and expected salary.


( Note : All resumes received from job applicants will be kept strictly confidential and will be used solely for recruitment purposes.)",5.0,5.0,DE
924,924,3 days ago,Senior Data Engineer/ Data Engineer,Data Engineer,,Computer Recruitment Consultants Limited,,,https://www.indeed.hk//rc/clk?jk=6ea04bf744660b60&fccid=0a60e8f28fc8330c&vjs=3,"North Point, Hong Kong Island","North Point, Hong Kong IslandOne of our clients, a listed Property Developer is currently seeking a suitable candidate to join their elite team.

The Job:
Design and develop enterprise big data analytic and collaborate with business users across the organization to assess their needs and define analytical strategy
Assist the evaluation, selection and implementation of tools for data integration, analytics, machine learning and visualization
Analyze structured and unstructured data, visualize findings and discover insights via data modelling, machine learning and optimization technique
Ensure the backup and recovery procedures are adequate and enforce information security standards and procedures

The Person:
Degree Holder in related disciplines
Minimum 3 years in Big Data architectural design
Proficient in R, Python, Scala, SAS, Perl, Matlab or other tools appropriate for large scale data analysis
Familiar with Hadoop,Map / Reduce and NoSQL
Solid experience in conducting business and system analysis with strong business acumen, and able to communicate actionable insights to management and non-technical audience
Strong leadership, analytical and communication skills and ability to work in a collaborative environment
Strong oral and written presentation in English and Chinese, Mandarin is a plus

Interested parties, please forward your resume in WORD FORMAT to recruit@crcltd.com.hk or fax to 2528-9091. The information provided by candidates will be treated in strict CONFIDENTIAL and will only be used for recruitment purpose",3.0,3.0,DE
925,925,30+ days ago,Security Analyst / Security Engineer – Data Center Operation,Data Engineer,,Talent Blue,2.0,5.0,https://www.indeed.hk//rc/clk?jk=ba8177eab3f92699&fccid=d78410deff673ba7&vjs=3,Hong Kong,"Hong KongOur client, known to provide data center service and operation to global clients in Asia Pacific is seeking a Security Analyst / Security Engineer to join the Security Team to ensure cyber security.

As a cyber security expert, you will provide critical security operations. This company’s depth and breadth of solutions will allow you to make an impact at the cutting edge of IT, while growing your expertise and capabilities through our commitment to professional development.
You will be part of the security team to provide the best cyber security framework implementation, control policies making and procedures

You will be a the first line of defense at the time of cyber attack, you will team up with IT Security to make the best decision to response.

You will drive cyber risk assessment on new business.

Requirements:

Degree holder in Computer Science, Information System or science.
At least 3 years of relevant experience in cybersecurity.
Holder of CISA or CISSP, CEH, etc.
Knowledge in Intrusion Detection Systems (IDS), signature management, ISO27001, ISO20000 and ITIL is preferred
Fluency in both written and spoken English and Chinese (Cantonese and Mandarin).
40K – 50K per month + bonus

Interested parties please send your resume to stephen.chow@talentbluesearch.com
Details
Reference #: TB-294
Industry: Information Technology and Telecommunications
Job Function: Information Technology
Level: Manager
Annual Package: 1 Million below",3.0,3.0,DE
926,926,30+ days ago,Security Engineer – Data Center Operation,Data Engineer,,Talent Blue,2.0,5.0,https://www.indeed.hk//rc/clk?jk=3f595ff062c1cd5d&fccid=d78410deff673ba7&vjs=3,Hong Kong,"Hong KongOur client, a major Data Center Operation in Hong Kong, is seeking a Security Engineer to drive the security for the IDC operation:
Responsibilities:

Observation, triage, correlation, analysis / investigation and closure of real time security events created by the security analytics and correlation platform
Deployment, configuration and management of security systems in alignment with industry standards
Using advanced analytics to create cyber analysis, observations, threat indicators, intelligent insight and recommended course of action
Day to day analysis of information systems security events for potential cyber-attacks
Cyber Security alerts, incidents and security management tools such as IPS, firewall review, endpoint protection, proxy, malware, security monitoring, log consolidation system etc
Using, enhancing and tuning tools for efficiently managing large collections of security events
Providing input to the design, assist in testing the functionality and participate in the operational readiness testing related to projects for data, systems and network security infrastructure / management
Acquiring knowledge of changing technologies in own area of responsibility and providing recommendations for adaptation technologies or policies
Requirements:

Degree holder in Information Technology Management or others.
3-5 years relevant working experience in IT, familiar with Platform, IT Security & Network design
Experience in network and host forensics
Advantage is given to CISSP, CEH, CISA etc
Knowledge in Intrusion Detection Systems (IDS), signature management, ISO27001, ISO20000 and ITIL is preferred
Extensive knowledge in security, intelligence and threat management
Fluency in written and spoken English, Cantonese and Mandarin.
460K – 520K per annual

Interested parties please send your resume to stephen.chow@talentbluesearch.com
Details
Reference #: TB-284
Industry: Information Technology and Telecommunications
Job Function: Engineering
Level: Manager
Annual Package: 1 Million below",5.0,5.0,DE
927,927,11 days ago,Facility Engineer -Data Center (數據中心值班工程師 ),Data Engineer,,Hong Kong District Cooling Company Limited,,,https://www.indeed.hk//rc/clk?jk=9bb917a1bd213a10&fccid=0f560123e7c6ed79&vjs=3,Hong Kong,"Hong Kong香港區域供冷有限公司是威立雅在香港的全資公司, 負責營運啟德發展區區域供冷系統. 為配合公司發展, 我們現誠邀閣下加入成為團隊成員之一.

工作職責:
負責日常檢查, 維修及保養數據中心冷氣/發電機與不間斷電力裝置等設備;

負責協助工程師跟進與數據中心設備有關的工程項目;

記錄日常錶頭及裝置設備資料.

職位要求:
中三或以上學歷/ VTC 証書課程;

具四年或以上相關工作經驗, 有機樓或數據中心維修經驗者優先;

需持有有效註冊電工A牌;

每週工作50小時, 需輪班工作.

新人獎金10,000.00

福利 : 11天有薪年假,個人醫療(包括牙科),年終花紅等

工作地點:　將軍澳工業村

有意者請按Apply Now申請

All applications applied through our system will be delivered directly to the advertiser and privacy of personal data of the applicant will be ensured with security.

Full-time",,,DE
928,928,30+ days ago,Senior Manager (Data Engineer),Data Engineer,,VSearch Infinity,,,https://www.indeed.hk//rc/clk?jk=1c03076c778f4f48&fccid=a495bfca28e26e8f&vjs=3,Hong Kong,"Hong KongGaming / Hospitality / Information Technology & Services
Senior Manager (Data Engineer) – Based in Hong Kong 12-Jul-2019
Responsibilities

Integrate data from various systems into a newly built data warehouse
Transform current ETL and analytics tool (e.g. from SAS to Python and Airflow)
Migrate existing applications & platforms from on-premise to cloud
Conduct research on new technology to identify opportunities and further improve efficiency
Challenge existing solutions with innovative technology concepts
Support in dashboard implementation and business analytics
Collaborate with Business Unit to understand company needs and IT operations to devise possible solutions and services
Requirements

Degree or above in Computer Science, Mathematics, Statistics or related discipline
6+ years of related work experience in data warehouse management and business analytics
Positive attitude, hard-working and a willingness to embrace new ideas
Experience in Database, ETL, Python and Cloud Technologies is a must
Knowledge in Airflow, SAS, Machine Learning and Tableau is preferred
Strong analytical mindset and problem solving skills
Fluency in both Chinese & English
Travels will be required.",,,DE
929,929,30+ days ago,Data Engineer,Data Engineer,,Mandurah Consultancy,,,https://www.indeed.hk//rc/clk?jk=51506730e9222e1d&fccid=524923cc2e0ed901&vjs=3,"Eastern District, Hong Kong Island","Eastern District, Hong Kong IslandOur client is one leading and very sizable organization in the industry providing IT&T solutions with business in both retail and corporate sectors.
Build enterprise big data analytic and AI blueprint and collaborate with business users across the organization to assess their needs and define analytical strategy
Assist the evaluation, selection and implementation of tools for data integration, analytics, machine learning and visualization
Analyze structured and unstructured data, visualize findings and discover insights via data modelling, machine learning and optimization technique
Build real time integration capabilities from data source and analytic platform to customer touch points
Collaborate with a broad spectrum of stakeholders, including marketers, technical expertise and product teams, etc.
Requirement: :
Bachelor Degree or above in Computer Science or related discipline
5+ years solid experience in sizable scale of business data analysis
Hands on experience on Intelligence & Analytical Tools, e.g. Perl, Scala, Python, SAS, etc. with knowledge on Hadoop framework, Spark, SQL is definitely an advantage
Solid experience in conducting business and system analysis with strong business acumen, and able to communicate actionable insights to management and non-technical audience
Strong numerical sense and analytical skill, presentable, independent, like challenging and able to work under pressure
Good command in both spoken English & Chinese (including Mandarin)",,,DE
